{
  "$schema": "neutralino.config.schema.json",
  "applicationId": "slsysl.manifesthub.gui",
  "version": "1.0.0",
  "defaultMode": "window",
  "port": 0,
  "documentRoot": "/resources/dist/",
  "url": "/",
  "enableServer": true,
  "enableNativeAPI": true,
  "tokenSecurity": "one-time",
  "logging": {
    "enabled": true,
    "writeToLogFile": true
  },
  "nativeAllowList": [
    "app.*",
    "os.*",
    "storage.*",
    "debug.log"
  ],
  "globalVariables": {},
  "modes": {
    "window": {
      "title": "ManifestHub GUI",
      "width": 800,
      "height": 500,
      "minWidth": 400,
      "minHeight": 200,
      "center": true,
      "fullScreen": false,
      "alwaysOnTop": false,
      "icon": "/resources/dist/logo.png",
      "enableInspector": false,
      "borderless": false,
      "maximize": false,
      "hidden": false,
      "resizable": true,
      "exitProcessOnClose": false
    },
    "browser": {
      "globalVariables": {},
      "nativeBlockList": [
        "filesystem.*"
      ]
    },
    "cloud": {
      "url": "/resources/#cloud",
      "nativeAllowList": [
        "app.*"
      ]
    },
    "chrome": {
      "width": 800,
      "height": 500,
      "args": "--user-agent=\"Neutralinojs chrome mode\"",
      "nativeBlockList": [
        "filesystem.*",
        "os.*"
      ]
    }
  },
  "cli": {
    "binaryName": "manifesthub-gui",
    "resourcesPath": "/resources/dist",
    "extensionsPath": "/extensions/",
    "binaryVersion": "6.9.0",
    "clientVersion": "6.9.0"
  }
}